{
  "schemaId": "https://codeflow.local/schemas/rflsc.representative-flow-catalog.v2.schema.json",
  "schemaVersion": 2,
  "catalogId": "catalog-domain-billing",
  "domainId": "domain-billing",
  "computedBasisId": "basis-vs07",
  "generationId": "generation-vs07",
  "validatedAgainstSnapshotId": "snapshot-vs07",
  "freshness": "historical",
  "flows": [{
    "flowId": "flow-billing",
    "title": "billing charge",
    "entrySymbol": "services/billing/charge.rb#Billing#charge",
    "complexityScore": 3,
    "keyMutations": [],
    "groundedMapId": "map-vs07",
    "generationId": "generation-vs07",
    "selectionReason": "deterministic evidence-backed ranking",
    "rationale": "selected from verified entry Evidence",
    "evidenceRefs": ["ev-billing"],
    "entryEvidenceRefs": ["ev-billing"],
    "resultEvidenceRefs": [],
    "confidence": 0.75,
    "epistemicState": "candidate",
    "coverageBoundary": {"includedSourceRoots": ["services"], "excludedReasons": []},
    "redactionStatus": "clean"
  }],
  "unmappedModules": [],
  "unknowns": [],
  "coverageBoundary": {"includedSourceRoots": ["services"], "excludedReasons": []},
  "recoveryGuidance": [],
  "redactionStatus": "clean"
}
